{
  "schema_version": "1.0",
  "contract_version": "1.0",
  "run": {
    "experiment_id": "pilot-2026-001",
    "run_id": "pilot-2026-001.case-001.example-tool.attempt-1",
    "adapter_id": "example-tool",
    "attempt": 1,
    "created_at": "2026-06-25T16:30:00Z",
    "requested_stages": [
      "unpack",
      "emulate",
      "endpoint-discovery"
    ]
  },
  "firmware": {
    "case_id": "case-001",
    "path": "/firmarbiter/input/firmware",
    "sha256": "aaaaaaaaaaaaaaaaaaaaaaaaaaaaaaaaaaaaaaaaaaaaaaaaaaaaaaaaaaaaaaaa",
    "size_bytes": 16777216,
    "delivery_semantics": "opaque-original-bytes",
    "read_only": true
  },
  "lifecycle": {
    "timeout_seconds": 10800,
    "heartbeat_interval_seconds": 30,
    "heartbeat_timeout_seconds": 90,
    "shutdown_grace_seconds": 60
  },
  "resources": {
    "cpu_cores": 4,
    "memory_bytes": 8589934592,
    "pids_limit": 4096
  },
  "runtime_grants": {
    "run_as_root": true,
    "network": "host",
    "requirements": [
      "loop-devices",
      "device-mapper",
      "tun-tap",
      "net-admin"
    ]
  },
  "hints": {
    "architecture": {
      "value": "mipsel",
      "source": "corpus-manifest"
    },
    "vendor": {
      "value": "example-vendor",
      "source": "corpus-manifest"
    }
  },
  "paths": {
    "workspace": "/firmarbiter/work",
    "artifacts": "/firmarbiter/artifacts",
    "events": "/firmarbiter/events/events.jsonl",
    "control": "/firmarbiter/control"
  },
  "integrity": {
    "adapter_manifest_sha256": "bbbbbbbbbbbbbbbbbbbbbbbbbbbbbbbbbbbbbbbbbbbbbbbbbbbbbbbbbbbbbbbb",
    "experiment_manifest_sha256": "cccccccccccccccccccccccccccccccccccccccccccccccccccccccccccccccc"
  }
}
